No,StarYear,"PlotCode",Name,Province,Amphoe,Tambon,Type,Lat,Lon,GMap,Tag_Count,SP_Count,Shanon,Biomass
201,2025,W63-25-P01,สวนสาธารณะเฉลิมพระเกียรติ ป่าไม้ชายน้ำปิง,ตาก,เมืองตาก,ป่ามะม่วง,P,16.86897,99.11956,"https://www.google.com/maps?t=k&q=16.86897,99.11956",80,16,2.23,"31,762.73"
202,2025,W63-25-S01,สวนสาธารณะแม่ปิงตาก,ตาก,เมืองตาก,ระแหง,S,16.86746,99.12372,"https://www.google.com/maps?t=k&q=16.86746,99.12372",20,9,1.71,"75,714.80"
203,2025,W70-25-M01,พิพิธภัณฑ์หนังใหญ่วัดขนอน,ราชบุรี,โพธาราม,สร้อยฟ้า,M,13.72694,99.84306,"https://www.google.com/maps?t=k&q=13.726944,99.843056",107,12,1.21,"80,567.36"
204,2025,W70-25-P01,สวนสาธารณะ ดงยาง,ราชบุรี,บ้านโป่ง,สวนกล้วย,P,13.81134,99.88733,"https://www.google.com/maps?t=k&q=13.8113361426561,99.8873338647086",39,3,0.82,"109,009.81"
205,2025,W70-25-S01,สระโกสินารายณ์และแนวกำแพงเมือง,ราชบุรี,บ้านโป่ง,บ้านโป่ง,S,13.85835,99.84943,"https://www.google.com/maps?t=k&q=13.858349,99.849428",75,29,3.17,"58,906.78"
206,2025,W77-25-M02,ศูนย์ปฏิบัติการที่ดินชัยพัฒนา-แม่ฟ้าหลวง,ประจวบคีรีขันธ์,หัวหิน,หนองพลับ,M,12.61361,99.75092,"https://www.google.com/maps?t=k&q=12.613614,99.750919",161,20,2.27,"35,874.87"
207,2025,W76-25-P01,สวนสุขภาพต่างระดับชะอำ,เพชรบุรี,ชะอำ,ชะอำ,P,12.8083,99.94407,"https://www.google.com/maps?t=k&q=12.8083,99.94407",20,9,1.94,"8,973.03"
208,2025,W76-25-S01,ชายหาดชะอำ,เพชรบุรี,ชะอำ,ชะอำ,S,12.78142,99.97897,"https://www.google.com/maps?t=k&q=12.781417,99.978972",58,1,0.00,"36,037.40"
209,2023,W77-02-M01,ป่าชายหาด สถานีฝึกนิสิตวนศาสตร์หาดวนกร,ประจวบคีรีขันธ์,ทับสะแก,ห้วยยาง,M,11.62003,99.6921,"https://www.google.com/maps?t=k&q=11.620032,99.692096",39,2,0.12,"131,249.24"
210,2025,W77-25-P01,หอดูดาวหว้ากอ อาคารดาราศาสตร์และอวกาศ,ประจวบคีรีขันธ์,เมืองประจวบคีรีขันธ์,คลองวาฬ,P,11.71765,99.75609,"https://www.google.com/maps?t=k&q=11.71765,99.75609",52,16,2.34,"21,881.80"
